[
  {
    "id": "web_recovery_001",
    "name": "Homepage Recovery",
    "url": "https://example.com/",
    "expected_status": 200,
    "recovery_timeout_ms": 5000,
    "tags": ["homepage", "smoke"]
  },
  {
    "id": "web_recovery_002",
    "name": "Login Page Recovery",
    "url": "https://example.com/login",
    "expected_status": 200,
    "recovery_timeout_ms": 5000,
    "tags": ["auth", "critical"]
  },
  {
    "id": "web_recovery_003",
    "name": "API Health Check Recovery",
    "url": "https://example.com/api/health",
    "expected_status": 200,
    "recovery_timeout_ms": 3000,
    "tags": ["api", "health"]
  }
]
